{
  "id": "b54b16e1-ac3b-4bff-a11f-f7ae9ddc27e0",
  "name": "MadTree Brewing 2.0",
  "brewery_type": "regional",
  "address_1": "5164 Kennedy Ave",
  "address_2": null,
  "address_3": null,
  "city": "Cincinnati",
  "state_province": "Ohio",
  "postal_code": "45213-1566",
  "country": "United States",
  "longitude": -84.4154,
  "latitude": 39.1776,
  "phone": "5138368733",
  "website_url": "https://madtreebrewing.com",
  "state": "Ohio",
  "street": "5164 Kennedy Ave"
}
