[
  {
    "id": "ae7b3174-8be8-4d53-a3a5-9b8240970eea",
    "name": "'s",
    "brewery_type": "brewpub",
    "address_1": "1 Friesener Straße",
    "address_2": null,
    "address_3": null,
    "city": "Kronach",
    "state_province": "Bayern",
    "postal_code": "96317",
    "country": "Germany",
    "longitude": 11.327765,
    "latitude": 50.241246,
    "phone": "+49 9261 628000",
    "website_url": "http://www.antla.de",
    "state": "Bayern",
    "street": "1 Friesener Straße"
  },
  {
    "id": "aa7cbe9b-3a0f-4888-9884-6186b0042b55",
    "name": "’t Drankorgel",
    "brewery_type": "micro",
    "address_1": "31a Geelsebaan",
    "address_2": null,
    "address_3": null,
    "city": "Mol",
    "state_province": "Vlaanderen",
    "postal_code": "2400",
    "country": "Belgium",
    "longitude": 5.0569549,
    "latitude": 51.1762578,
    "phone": "+32 496 76 40 63",
    "website_url": "http://tdrankorgel.be/",
    "state": "Vlaanderen",
    "street": "31a Geelsebaan"
  },
  {
    "id": "b54b16e1-ac3b-4bff-a11f-f7ae9ddc27e0",
    "name": "MadTree Brewing 2.0",
    "brewery_type": "regional",
    "address_1": "5164 Kennedy Ave",
    "address_2": null,
    "address_3": null,
    "city": "Cincinnati",
    "state_province": "Ohio",
    "postal_code": "45213-1566",
    "country": "United States",
    "longitude": -84.4154,
    "latitude": 39.1776,
    "phone": "5138368733",
    "website_url": "https://madtreebrewing.com",
    "state": "Ohio",
    "street": "5164 Kennedy Ave"
  }
]
